<!DOCTYPE Treatment SYSTEM "treatment.dtd">
<Treatment ShortName="AssJ">
    <Description>
        She will undergo surgery to "enhance" her ass.
        *(Takes 5 turns, less if a Nurse is on duty)
    </Description>

    <Surgery Duration="5">
        <TraitExclude Trait="Great Arse">${name} already has a Great Arse.</TraitExclude>
    </Surgery>

    <Messages>
        <Message Name="surgery">
            <Text>${name} is in the Clinic to get her ass worked on.</Text>
        </Message>
        <Message Name="doctor.work">
            <Text>Today, she worked on ${name}, sculpting her ass.</Text>
        </Message>

        <Include>DefaultSurgeryMessages.xml</Include>
    </Messages>
</Treatment>
