<!DOCTYPE Treatment SYSTEM "treatment.dtd">
<Treatment ShortName="CosS">
    <Description>
        She will undergo magical surgery to "enhance" her appearance.
        *(Takes up to 5 turns, less if a Nurse is on duty)
    </Description>

    <Surgery Duration="5" />

    <Messages>
        <Message Name="surgery">
            <Text>${name} is in the Clinic to get cosmetic surgery.</Text>
        </Message>

        <Message Name="doctor.work">
            <Text>Today, she worked on improving ${name}'s appearance.</Text>
        </Message>

        <Include>DefaultSurgeryMessages.xml</Include>
    </Messages>
</Treatment>
